<?xml version="1.0" encoding="UTF-8" ?>

<schema xmlns="http://www.w3.org/2001/XMLSchema"
        targetNamespace="http://it.by/shumilov/xmlschema"
        xmlns:tns="http://it.by/shumilov/xmlschema"
        elementFormDefault="qualified">

    <element name="Students">
        <complexType><!--сложный-->
            <sequence><!--по порядку-->
                <element name="Student"
                        type="tns:Student"
                        maxOccurs="unbounded">

                </element>
            </sequence>
        </complexType>
    </element>

    <complexType name="Student">
        <sequence>
            <element name="Person" type="tns:Person" maxOccurs="1"/>
            <element name="CoursesStudent" type="tns:CoursesStudent"/>
        </sequence>
    </complexType>

    <complexType name="Person">
        <sequence>
            <element name="Login" type="string"/>
            <element name="Password" type="string"/>
            <element name="Email" type="string"/>
            <element name="FirstName" type="string"/>
            <element name="SecondName" type="string"/>
        </sequence>
    </complexType>


    <complexType name="CoursesStudent">
            <sequence>
                <element name="CourseStudent"
                         type="tns:CourseStudent"
                         maxOccurs="unbounded">
                </element>
            </sequence>
    </complexType>

    <complexType name="CourseStudent">
        <sequence>
            <element name="Course" type="tns:Course"/>
        </sequence>
        <attribute name="mark" type="int"/>
    </complexType>

    <complexType name="Course">
        <sequence>
            <element name="Name" type="string"/>
            <element name="Subject" type="string"/>
            <element name="Start" type="date"/>
            <element name="End" type="date"/>
            <element name="Teacher" type="tns:Teacher"/>
        </sequence>
    </complexType>


    <complexType name="Teacher">

        <sequence>
            <element name="Person" type="tns:Person" maxOccurs="1"/>
        </sequence>
        <attribute name="department" type="string" use="required"/>
    </complexType>
</schema>