<?xml version="1.0" encoding="UTF-8" ?>

<Students xmlns="http://it.by/shumilov/xmlschema"
         xmlns:xsi="http://www.w3.org/2001/XMLSchema-instance"
         xsi:schemaLocation="http://it.by/shumilov/xmlschema Schema.xsd" >


    <Student>
        <Person>
            <Login>Vasya</Login>
            <Password>pa$$word</Password>
            <Email>vas2018@mail.ru</Email>
            <FirstName>Vasilii</FirstName>
            <SecondName>Terkin</SecondName>
        </Person>
        <CoursesStudent>
            <CourseStudent mark="3">
                <Course>
                    <Name>Physics things</Name>
                    <Subject>Physics</Subject>
                    <Start>2018-01-12</Start>
                    <End>2018-05-12</End>
                    <Teacher department="Physics">
                        <Person>
                            <Login>Vit</Login>
                            <Password>pa$$word1</Password>
                            <Email>vit2018@mail.ru</Email>
                            <FirstName>Vitalii</FirstName>
                            <SecondName>New</SecondName>
                        </Person>
                    </Teacher>

                </Course>

            </CourseStudent>
            <CourseStudent>
                <Course>
                    <Name>Math things</Name>
                    <Subject>Math</Subject>
                    <Start>2018-01-12</Start>
                    <End>2018-07-12</End>

                        <Teacher department="Math">
                            <Person>
                                <Login>Stas</Login>
                                <Password>pa$$word3</Password>
                                <Email>stas2018@mail.ru</Email>
                                <FirstName>Stas</FirstName>
                                <SecondName>Lin</SecondName>
                            </Person>
                        </Teacher>

                </Course>
            </CourseStudent>
        </CoursesStudent>
    </Student>
</Students>